ISO	Include	Country	Nationality	Capital	Continent	Population	Language	Conservative Dress Code	National Dish	Top Dishes	Flag Colors	Top Attractions	Sport People	Fight People
MN	TRUE	Mongolia	Mongolian	Ulaanbaatar	Asia	3075647	Mongolian	FALSE	Buuz	Khuushuur, Airag, Aarts	Red, Blue	Gobi Desert, Erdene Zuu Monastery, Khövsgöl Nuur	Hakuhō Shō	Hakuhō Shō
ME	TRUE	Montenegro	Montenegrin	Podgorica	Europe	614261	Montenegrin, Serbian	FALSE	Njeguški Stek	Kacamak, Priganice, Ispod Saca	Red, Blue	Bay of Kotor, Sveti Stefan, Durmitor National Park		
MS	FALSE	Montserrat	Montserratian	Plymouth	North America	4992	English	FALSE	Goat Water	Johnny Cakes, Conch Soup, Souse	Green, Yellow	Soufrière Hills Volcano, Rendezvous Beach, Little Bay		
MA	TRUE	Morocco	Moroccan	Rabat	Africa	36029138	Arabic, Berber	TRUE	Tagine	Couscous, Harira, Pastilla	Red, Green	Marrakech Medina, Hassan II Mosque, Chefchaouen		
MZ	TRUE	Mozambique	Mozambican	Maputo	Africa	31255435	Portuguese	FALSE	Piri Piri Chicken	Matapa, Acarajé, Cashew Nuts	Green, Yellow, Black, White	Bazaruto Archipelago, Ilha de Mozambique, Gorongosa National Park		
MM	TRUE	Myanmar	Burmese	Naypyidaw	Asia	54409794	Burmese	FALSE	Mohinga	Ohn No Khao Swè, Laphet Thohk, Shan Noodles	Yellow, Green	Shwedagon Pagoda, Bagan, Inle Lake		
NA	TRUE	Namibia	Namibian	Windhoek	Africa	2587801	English	FALSE	Braaivleis	Potjiekos, Biltong, Kapana	Blue, Red, Green, White, Black	Namib Desert, Fish River Canyonm, Etosha National Park		
NR	FALSE	Nauru	Nauruan	Yaren	Oceania	10756	Nauruan, English	FALSE	Coconut Fish Soup	Luau, Taro, Kawa	Blue, Yellow, White	Buada Lagoon, Anibare Bay, Moqua Caves		
NP	TRUE	Nepal	Nepali	Kathmandu	Asia	29996478	Nepali	FALSE	Dal Bhat	Momos, Sel Roti, Yomari	Crimson	Pashupatinath Temple, Swayambhunath Stupa, Mount Everest		
NL	TRUE	Netherlands	Dutch	Amsterdam	Europe	17084719	Dutch	FALSE	Stroopwafel	Bitterballen, Haring, Erwtensoep	Red, White, Blue	Keukenhof Gardens, Anne Frank House, Rijksmuseum		Alistair Overeem,  Ernesto Hoost, Peter Aerts 
NC	FALSE	New Caledonia	New Caledonian	Nouméa	Oceania	284060	French	FALSE	Bougna	Bami, Nems, Yams	Blue, Red	Île des Pins, Heart of Voh, Amedee Island		
NZ	TRUE	New Zealand	New Zealander	Wellington	Oceania	4986554	English, Maori	FALSE	Hangi	Pavlova, Kiwi Burger, Whitebait Fritters	Black, White	Bay of Islands, Milford Sound, Tongariro Alpine Crossing	Jonah Lomu,Richie McCaw	
NI	TRUE	Nicaragua	Nicaraguan	Managua	North America	6545502	Spanish	FALSE	Gallo Pinto	Nacatamal, Indio Viejo, Quesillo	Blue, White	Ometepe Island, Cerro Negro Volcano, Granada's Colonial Architecture		
NE	TRUE	Niger	Nigerien	Niamey	Africa	24206644	French	FALSE	Riz Gras	Kuli Kuli, Wassaké, Damboua	Orange, White, Green	W National Park, Air Mountains, Agadez		
NG	TRUE	Nigeria	Nigerian	Abuja	Africa	206139589	English	FALSE	Jollof Rice	Suya, Pounded Yam, Moi Moi	Green, White, Green	Yankari National Park, Zuma Rock, Olumo Rock		
NU	FALSE	Niue	Niuean	Alofi	Oceania	1624	Niuean, English	FALSE	Uga	Poke, Takihi, Ika Mata	Blue, Yellow	Avaiki Cave, Matapa Chasm, Limu Pools		
NF	FALSE	Norfolk Island	Norfolk Islander	Kingston	Oceania	1748	English, Norfuk	FALSE	Potato Scone	Norfolk Ribs, Baunti Biscuits, Banana Stew	Green, White	Kingston and Arthur's Vale Historic Area, Anson Bay, Emily Bay		
KP	TRUE	North Korea	North Korean	Pyongyang	Asia	25778816	Korean	FALSE	Kimchi	Naengmyeon, Japchae, Bulgogi	Red, White, Blue	Kumsusan Palace of the Sun, Juche Tower, Mangyongdae		
MK	TRUE	North Macedonia	North Macedonian	Skopje	Europe	2083374	Macedonian	FALSE	Tavče Gravče	Ajvar, Pastrmajlija, Burek	Red, Yellow	Lake Ohrid, Matka Canyon, Skopje Old Bazaar		
NN	TRUE	Northern Ireland	North Irish	Belfast	Europe	1893667	English	FALSE	Ulster Fry	Pastie Supper, Irish Stew, Wheaten Bread	Red, White	Giant's Causeway, Carrick-a-Rede Rope Bridge, Titanic Belfast		
MP	FALSE	Northern Mariana Islands	Northern Mariana Islander	Saipan	Oceania	51433	English, Chamorro, Carolinian	FALSE	Kadun Pika	Chicken Kelaguen, Apigigi, Buñelos Manglo	Blue, White	Suicide Cliff, Managaha Island, Forbidden Island		
NO	TRUE	Norway	Norwegian	Oslo	Europe	5421241	Norwegian, Sami	FALSE	Rakfisk	Kjøttkaker, Lefse, Raspeballer	Red, White, Blue	Geirangerfjord, Northern Lights, Nidaros Cathedral		
OM	TRUE	Oman	Omani	Muscat	Asia	5231375	Arabic	TRUE	Shuwa	Makbous, Saloona, Majboos	Red, White, Green	Sultan Qaboos Grand Mosque, Wahiba Sands, Al Jalali and Al Mirani Forts		
PK	TRUE	Pakistan	Pakistani	Islamabad	Asia	225199937	Urdu, English	TRUE	Biryani	Nihari, Haleem, Seekh Kebab	Green, White	Karimabad Hunza, Badshahi Mosque, Mohenjo-daro	Imran Khan	
PW	FALSE	Palau	Palauan	Ngerulmud	Oceania	18094	English, Palauan	FALSE	Rösti	Tamales, Kima, Bat Soup	Blue, Yellow, White	Rock Islands, Jellyfish Lake, Babeldaob Island		
PS	TRUE	Palestine	Palestinian	Ramallah	Asia	5226953	Arabic	TRUE	Maqluba	Knafeh, Musakhan, Falafel	Black, Green, White	Old City of Jerusalem, Bethlehem, Mount of Olives		
PA	TRUE	Panama	Panamanian	Panama City	North America	4399397	Spanish	FALSE	Sancocho	Ceviche, Arroz con Pollo, Hojaldre	White, Blue, Red	Bocas del Toro, Casco Viejo, Panama Canal		Roberto Durán
PG	TRUE	Papua New Guinea	Papua New Guinean	Port Moresby	Oceania	906012	English, Tok Pisin	FALSE	Mumu	Kaukau, Sago, Kokoda	Black, Red, Yellow	Kokoda Track, Sepik River, Tufi Dive Resort		
PY	TRUE	Paraguay	Paraguayan	Asunción	South America	7132535	Spanish, Guarani	FALSE	Sopa Paraguaya	Chipa, Mbeju, Bori Bori	Red, White, Blue	Ybycuí National Park, Jesuit Missions, Itaipu Dam		
PE	TRUE	Peru	Peruvian	Lima	South America	33480550	Spanish	FALSE	Ceviche	Lomo Saltado, Aji de Gallina, Causa Rellena	Red, White	Machu Picchu, Colca Canyon, Nazca Lines		
PH	TRUE	Philippines	Filipino	Manila	Asia	112850641	Filipino, English	FALSE	Adobo	Sinigang, Kare-Kare, Halo-Halo	Blue, Red, White, Yellow	El Nido, Banaue Rice Terraces, Chocolate Hills	Manny Pacquiao	Manny Pacquiao
PN	FALSE	Pitcairn Islands	Pitcairn Islander	Adamstown	Oceania	47	English, Pitkern	FALSE			Blue	Bounty Bay, Henderson Island, St. Paul's Pool		
PL	TRUE	Poland	Polish	Warsaw	Europe	37846611	Polish	FALSE	Bigos	Pierogi, Kielbasa, Barszcz	White, Red	Wawel Castle, Warsaw Old Town, Białowieża Forest		
PT	TRUE	Portugal	Portuguese	Lisbon	Europe	10196709	Portuguese	FALSE	Bacalhau	Pastéis de Nata, Francesinha, Caldo Verde	Green, Red, Yellow	Douro Valley, Pena Palace, Belém Tower	Cristiano Ronaldo	
PR	TRUE	Puerto Rico	Puerto Rican	San Juan	North America	2860853	Spanish, English	FALSE	Mofongo	Arroz con Gandules, Lechón, Tostones	Blue, White, Red	Old San Juan, Culebra Island, El Yunque National Forest		
QA	TRUE	Qatar	Qatari	Doha	Asia	2881053	Arabic	TRUE	Machbous	Harees, Majboos, Thareed	Maroon, White	The Pearl-Qatar, Souq Waqif, Museum of Islamic Art		
RE	TRUE	Réunion	Réunionese	Saint-Denis	Africa	895312	French	FALSE	Rougail	Carri, Samoussa, Bonbons piments	Blue, White, Red, Green	Piton de la Fournaise, Trou de Ferm, Cirque de Mafate		
RO	TRUE	Romania	Romanian	Bucharest	Europe	19237691	Romanian	FALSE	Mămăligă	Sarmale, Mici, Mămăligă cu Brânză	Blue, Yellow, Red	Bran Castle, Palace of the Parliament, Peleș Castle	Nadia Comăneci	
RU	TRUE	Russia	Russian	Moscow	Europe	145912025	Russian	FALSE	Borscht	Pelmeni, Blini, Beef Stroganoff	White, Blue, Red	Red Square, Lake Baikal, Hermitage Museum	Fedor Emelianko, Khabib Nurmagomedov, Aleksandr Karelin	Fedor Emelianko, Khabib Nurmagomedov, Aleksandr Karelin
RW	TRUE	Rwanda	Rwandan	Kigali	Africa	13026273	Kinyarwanda, French, English	FALSE	Isombe	Ugali, Brochettes, Nyama Choma	Blue, Yellow, Green	Volcanoes National Park, Lake Kivu, Kigali Genocide Memorial		
BL	FALSE	Saint Barthélemy	Saint Barthélemois	Gustavia	North America	9877	French	FALSE	Salad	Grilled Lobster, Accras, Blaff	White, Red, Blue	St. Jean Beach, Colombier Beach, Anse des Flamands		
SH	FALSE	Saint Helena, Ascension and Tristan da Cunha	Saint Helenian	Jamestown	Africa	5633	English	FALSE	Fishcakes	Fried Plantains, Plo, Ginger Beer	Blue, White, Red	Longwood House, Green Mountain, Jacob's Ladder		
KN	FALSE	Saint Kitts and Nevis	Kittitian or Nevisian	Basseterre	North America	53199	English	FALSE	Goat Water	Conch Fritters, Jerk Chicken, Roti	Green, Red	Brimstone Hill Fortress, South Friars Beach, Nevis Peak		
LC	TRUE	Saint Lucia	Saint Lucian	Castries	North America	184401	English	FALSE	Green Fig and Saltfish	Callaloo Soup, Roast Pork, Black Cake	Blue, Yellow, Black	Pitons, Pigeon Island, Sulphur Springs		
MF	FALSE	Saint Martin	Saint-Martinoise	Marigot	North America	38666	Dutch, English	FALSE	St. Martin's Mahi-Mahi	Johnny Cake, Lolo, Conch Fritters	Red, White, Blue	Maho Beach, Great Bay Beach, Loterie Farm		
PM	FALSE	Saint Pierre and Miquelon	Saint-Pierrais or Miquelonnais	Saint-Pierre	North America	5771	French, English	FALSE	Kadun Pika	Chicken Kelaguen, Apigigi, Buñelos Manglo	Blue, White	Suicide Cliff, Managaha Island, Forbidden Island		
VC	TRUE	Saint Vincent-Grenadines	Vincentian	Kingstown	North America	110210	English	FALSE	Roasted Breadfruit	Conch, Johnny Cakes, Accras	Blue, Green, Yellow	Dark View Falls, Tobago Cays, Kingstown		
WS	TRUE	Samoa	Samoan	Apia	Oceania	200874	Samoan, English	FALSE	Sapasui	Oka, Palusami, Panikeke	Red, Blue	To Sua Ocean Trench, Lalomanu Beach, Piula Cave Pool		
SM	TRUE	San Marino	Sammarinese	City of San Marino	Europe	33938	Italian	FALSE	Cappelletti	Nidi di Rondine, Fagioli con le Cotiche, Strozzapreti	White, Blue	Guaita, Cesta and Montale Towers, Basilica of San Marino, Piazza della Libertà		
ST	TRUE	São Tomé and Príncipe	São Toméan	São Tomé	Africa	221027	Portuguese	FALSE	Feijoada	Calulu, Mucuza, Búzio	Green, Yellow, Black	Lagoa Azul, Pico Cão Grande, Obo National Park		
SA	TRUE	Saudi Arabia	Saudi Arabian	Riyadh	Asia	35340743	Arabic	TRUE	Kabsa	Mutabbaq, Shawarma, Samboosa	Green	Medina, Mecca, Al-Ula		
SQ	TRUE	Scotland	Scottish	Edinburgh	Europe	5457175	English, Scottish Gaelic	FALSE	Haggis	Cullen Skink, Welsh Cakes, Bara Brith	Blue, White	Isle of Skye, Edinburgh Castle, Loch Ness		
SN	TRUE	Senegal	Senegalese	Dakar	Africa	16743930	French	FALSE	Thieboudienne	Yassa, Mafé, Bissap	Green, Yellow, Red	Gorée Island, Pink Lake, Djoudj National Bird Sanctuary		
RS	TRUE	Serbia	Serbian	Belgrade	Europe	6925188	Serbian	FALSE	Ćevapi	Karađorđeva šnicla, Gibanica, Pasulj	Red, Blue, White	Belgrade Fortress, Church of Saint Sava, Tara National Park	Novak Djokovic	
SC	TRUE	Seychelles	Seychellois	Victoria	Africa	98347	Seychellois Creole, English, French	FALSE	Ladob	Octopus Curry, Shark Chutney, Sausage Rougay	Blue, Yellow, Red, White	Vallée de Mai, Anse Lazio, Aldabra Atoll		
SL	TRUE	Sierra Leone	Sierra Leonean	Freetown	Africa	7976985	English	FALSE	Cassava Leaves	Potato Leaves, Okra Soup, Jollof Rice	Green, White, Blue	Outamba-Kilimi National Park, Bunce Island, Tacugama Chimpanzee Sanctuary		
SG	TRUE	Singapore	Singaporean	Singapore	Asia	5896684	English, Malay, Tamil, Chinese	FALSE	Hainanese Chicken Rice	Laksa, Char Kway Teow, Satay	Red, White	Gardens by the Bay, Sentosa Island, Marina Bay Sands		
SX	FALSE	Sint Maarten	Sint Maartener	Philipsburg	North America	42876	Dutch, English	FALSE	St. Martin's Mahi-Mahi	Johnny Cake, Lolo, Conch Fritters	Red, White, Blue	Maho Beach, Great Bay Beach, Loterie Farm		
SK	TRUE	Slovakia	Slovak	Bratislava	Europe	5459642	Slovak	FALSE	Bryndzové Halušky	Kapustnica, Segedin Goulash, Parenica	White, Blue, Red	Orava Castle, High Tatras, Bratislava Castle		
SI	TRUE	Slovenia	Slovenian	Ljubljana	Europe	2078938	Slovene	FALSE	Štruklji	Potica, Idrijski Žlikrofi, Jota	White, Blue, Red	Lake Bled, Ljubljana Castle, Postojna Cave		
SB	TRUE	Solomon Islands	Solomon Islander	Honiara	Oceania	686884	English	FALSE	Sago	Poi, Taro, Fish Soup	Blue, Yellow, Green	Honiara Central Market, Bonegi I and II, Marovo Lagoon		
SO	TRUE	Somalia	Somali	Mogadishu	Africa	10787104	Somali, Arabic	TRUE	Anjero	Sambusa, Bariis, Lahoh	Blue, White	Lamadaya Waterfall, Laas Geel, Mogadishu Cathedral		
ZA	TRUE	South Africa	South African	Pretoria, Bloemfontein, Cape Town	Africa	55908865	Afrikaans, English, Zulu	FALSE	Bobotie	Bunny Chow, Biltong, Malva Pudding	Black, Green, Yellow, White, Blue	Table Mountain, Kruger National Park, Robben Island	Bryan Habana	
GS	FALSE	South Georgia and the South Sandwich Islands	South Georgia or South Sandwich Islander	King Edward Point	Antarctica	30	English	FALSE			Blue, White, Red	Grytviken, Gold		
KR	TRUE	South Korea	South Korean	Seoul	Asia	48422644	Korean	FALSE	Bulgogi	Bibimbap, Kimchi Jjigae, Tteokbokki	White, Blue, Red	Gyeongbokgung Palace, Jeju Island, Myeongdong Shopping Street		
SS	TRUE	South Sudan	South Sudanese	Juba	Africa	12778250	English	FALSE	Ful	Kisra, Nyetenyere, Asida	Black, Red, Green, Blue	Boma National Park, Badingilo National Park, Juba Market		
ES	TRUE	Spain	Spanish	Madrid	Europe	46443959	Spanish	FALSE	Paella	Tapas, Jamón Ibérico, Gazpacho	Red, Yellow	Sagrada Familia, Alhambra, Park Güell	Rafael Nadal	
LK	TRUE	Sri Lanka	Sri Lankan	Colombo, Sri Jayawardenepura Kotte	Asia	21803000	Sinhala, Tamil	FALSE	Rice and Curry	Hoppers, Kottu, Lamprais	Orange, Green	Sigiriya, Temple of the Tooth, Yala National Park		
SD	TRUE	Sudan	Sudanese	Khartoum	Africa	40234882	Arabic, English	TRUE	Ful Medames	Kisra, Aseeda, Kebab	Red, White, Black, Green	Pyramids of Meroe, Nubian Desert, Suakin		
SR	TRUE	Suriname	Surinamese	Paramaribo	South America	541638	Dutch	FALSE	Roti	Pom, Bami, Saoto Soup	Green, White, Red	Galibi Nature Reserve, Brownsberg Nature Park, Central Suriname Nature Reserve		
SJ	FALSE	Svalbard and Jan Mayen	Svalbardian	Longyearbyen	Europe	2655	Norwegian	FALSE			Red, White, Blue	Svalbard Global Seed Vault, Barentsburg, North Pole		
SE	TRUE	Sweden	Swedish	Stockholm	Europe	9696110	Swedish	FALSE	Swedish Meatballs	Gravad Lax, Raggmunk, Smörgåsbord	Blue, Yellow	Red Cottage at Abisko National Park, Stockholm Archipelago, Vasa Museum	Zlatan Ibrahimović, Ingemar Stenmark	
CH	TRUE	Switzerland	Swiss	Bern	Europe	8139631	German, French, Italian, Romansh	FALSE	Fondue	Rösti, Raclette, Zürcher Eintopf	Red, White	Jungfrau Region, Matterhorn, Lake Geneva	Roger Federer	
SY	TRUE	Syria	Syrian	Damascus	Asia	18564087	Arabic	TRUE	Kibbeh	Mansaf, Fattoush, Tabbouleh	Red, White, Black	Palmyra, Umayyad Mosque, Krak des Chevaliers		
TW	TRUE	Taiwan	Taiwanese	Taipei	Asia	23415126	Mandarin	FALSE	Beef Noodle Soup	Bubble Tea, Stinky Tofu, Scallion Pancakes	Red, White, Blue	Taroko Gorge, Sun Moon Lake, Taipei 101		
TJ	TRUE	Tajikistan	Tajikistani	Dushanbe	Asia	8481855	Tajik	TRUE	Osh	Lagman, Plov, Shurbo	Red, White, Green	Fann Mountains, Iskanderkul Lake, Ismoil Somoni Monument		
TZ	TRUE	Tanzania	Tanzanian	Dodoma	Africa	53771296	Swahili, English	FALSE	Ugali	Pilau, Nyama Choma, Mandazi	Green, Yellow, Blue	Zanzibar, Mount Kilimanjaro, Serengeti National Park		
TH	TRUE	Thailand	Thai	Bangkok	Asia	68297514	Thai	FALSE	Pad Thai	Tom Yum Goong, Som Tum, Massaman Curry	Red, White, Blue	Grand Palace,  Phi Phi Islands, Ayutthaya Historical Park		
TL	TRUE	Timor-Leste	East Timorese	Dili	Asia	1296311	Tetum, Portuguese, English	FALSE	Batar Daan	Bacalhau a Bras, Xirang, Tukir	Red, Yellow, Black	Christo Rei of Dili, Atauro Island, Tais Market		
TG	TRUE	Togo	Togolese	Lomé	Africa	7304578	French	FALSE	Fufu	Akume, Gboma Dessi, Ablo	Green, Yellow, White	Koutammakou, Tamberma Valley, Grand Marche Lome		
TO	TRUE	Tonga	Tongan	Nuku'alofa	Oceania	109008	Tongan, English	FALSE	Ota Ika	Lu Pulu, Otai, 'Ota Ika	Red, White	Ha'atafu Beach, Tongatapu Blowholes, Ha'amonga 'a Maui Trilithon		
TT	TRUE	Trinidad and Tobago	Trinidadian or Tobagonian	Port of Spain	North America	1349667	English	FALSE	Roti	Doubles, Callaloo, Pelau	Red, White, Black	Maracas Bay, Pitch Lake, Caroni Bird Sanctuary		
TN	TRUE	Tunisia	Tunisian	Tunis	Africa	10673800	Arabic	TRUE	Couscous	Brik, Mechouia, Lablabi	Red, White	El Djem Amphitheatre, Medina of Tunis, Carthage		
TR	TRUE	Turkey	Turkish	Ankara	Asia, Europe	80417526	Turkish	TRUE	Kebab	Lahmacun, Baklava, Menemen	Red	Hagia Sophia, Pamukkale, Cappadocia		
TM	TRUE	Turkmenistan	Turkmen	Ashgabat	Asia	5373502	Turkmen	TRUE	Plov	Eşek çiğirtmesi, Chal, Govurma	Green, White	Door to Hell, Ancient Merv, Yangykala Canyon		
TC	FALSE	Turks and Caicos Islands	Turks and Caicos Islander	Cockburn Town	North America	31458	English	FALSE	Conch	Rice and Beans, Peas Soup, Johnny Cakes	Blue, White	Grace Bay, Chalk Sound, Conch Bar Caves		
TV	FALSE	Tuvalu	Tuvaluan	Funafuti	Oceania	10640	Tuvaluan, English	FALSE	Funafuti Fekei	Palusami, Coconut Crab, Taro	Blue, Yellow, White	Funafuti Marine Conservation Area, Nanumea, Funafuti Lagoon		
UG	TRUE	Uganda	Ugandan	Kampala	Africa	35873253	English, Swahili	FALSE	Matoke	Posho, Luwombo, Rolex	Black, Yellow, Red	Bwindi Impenetrable National Park, Murchison Falls National Park, Lake Victoria		
UA	TRUE	Ukraine	Ukrainian	Kyiv	Europe	45004645	Ukrainian	FALSE	Borscht	Varenyky, Holubtsi,	Blue, Yellow	Kyiv Pechersk Lavra, Lviv Old Town, Carpathian Mountains		
AE	TRUE	United Arab Emirates	Emirati	Abu Dhabi	Asia	9890400	Arabic	TRUE	Al Harees	Shawarma, Al Machboos, Luqaimat	Black, Red, Green, White	Sheikh Zayed Grand Mosque, Burj Khalifa, Dubai Mall		
GB	FALSE	United Kingdom	British	London	Europe	68129869	English	FALSE	Fish and Chips	Roast Beef and Yorkshire Pudding, Full English Breakfast, Cornish Pasty	Red, White, Blue	Big Ben, Buckingham Palace, Tower of London		
US	TRUE	United States	American	Washington, D.C.	North America	331002651	English	FALSE	Hamburger	Hot Dog, Apple Pie, Clam Chowder	Red, White, Blue	Grand Canyon, Statue of Liberty, Times Square	Lebron James, Michael Jordan, Tom Brady, Serena Williams, Tiger Woods, Babe Ruth, Michael Phelps, Mark Henry, Muhammad Ali, Mike Tyson, Ronda Rousey, Danica Patrick	Muhammad Ali, Mike Tyson, Brock Lesnar, Chuck Norris, Ronda Rousey, Dwayne Johnson
VI	FALSE	United States Virgin Islands	United States Virgin Islander	Charlotte Amalie	North America	106235	English	FALSE			White, Red	Trunk Bay, Magens Bay, Buck Island		
UY	TRUE	Uruguay	Uruguayan	Montevideo	South America	3473730	Spanish	FALSE	Asado	Chivito, Milanesa, Panchos	White, Blue	Plaza Independencia, Punta del Este, Casapueblo		
UZ	TRUE	Uzbekistan	Uzbek	Tashkent	Asia	33469203	Uzbek	FALSE	Plov	Shashlik, Manti, Lagman	Blue, White, Green	Registan, Samarkand, Aydarkul Lake		
VU	TRUE	Vanuatu	Ni-Vanuatu	Port Vila	Oceania	307145	Bislama, English, French	FALSE	Lap Lap	Coconut Crab, Tuluk, Nalot	Green, Yellow, Red	Mount Yasur, Champagne Beach, Millennium Cave		
VA	FALSE	Vatican	Vaticanian	Vatican City	Europe	801	Italian, Latin, French	FALSE			White, Gold	St. Peter's Basilica, Vatican Museums, Sistine Chapel		
VE	TRUE	Venezuela	Venezuelan	Caracas	South America	28435943	Spanish	FALSE	Pabellón Criollo	Arepa, Hallaca, Cachapa	Yellow, Blue, Red	Angel Falls, Morrocoy National Park, Roraima		
VN	TRUE	Vietnam	Vietnamese	Hanoi	Asia	97338579	Vietnamese	FALSE	Phở	Bún Chả, Bánh Mì, Gỏi Cuốn	Red	Hạ Long Bay, Hội An, Sa Pa		
WA	TRUE	Wales	Welsh	Cardiff	Europe	3121966	English, Welsh	FALSE	Welsh Rarebit	Glamorgan Sausage, Laverbread, Welsh Cakes	White, Green, Red	Cardiff Castle, Snowdonia National Park, St. Fagans National Museum of History		
WF	FALSE	Wallis and Futuna	Wallisian, Futunan, French	Mata-Utu	Oceania	11773	French	FALSE			Red, White	Mata-Utu Cathedral, Talietumu, Lake Lalolalo		
EH	FALSE	Western Sahara	Sahrawi, Arabic, Spanish	El Aaiún	Africa	597339	Arabic, Spanish	FALSE			Black, White, Green	Dakhla Oasis, Laayoune, Smara		
YE	TRUE	Yemen	Yemeni	Sana'a	Asia	29825968	Arabic	TRUE	Saltah	Mandi, Bint Al Sahn, Fasulia	Red, White, Black	Socotra, Old City of Sana'a, Al-Mahwit Dam		
ZM	TRUE	Zambia	Zambian	Lusaka	Africa	18383955	English	FALSE	Nshima	Chikanda, Kapenta, Munkoyo	Green, Orange, Black	Victoria Falls, Lower Zambezi National Park, South Luangwa National Park		
ZW	TRUE	Zimbabwe	Zimbabwean	Harare	Africa	14862924	English	FALSE	Sadza	Biltong, Boerewors, Mazondo	Green, Yellow, Red, Black, White	Victoria Falls, Great Zimbabwe, Hwange National Park		